{
  "$schema": "https://json-schema.org/draft/2020-12/schema",
  "$id": "cautilus.scenario_proposals.v1",
  "type": "object",
  "required": [
    "schemaVersion",
    "generatedAt",
    "windowDays",
    "families",
    "proposalTelemetry",
    "attentionView",
    "proposals"
  ],
  "properties": {
    "schemaVersion": {
      "type": "string",
      "const": "cautilus.scenario_proposals.v1"
    },
    "generatedAt": {
      "type": "string"
    },
    "windowDays": {
      "type": "integer",
      "minimum": 1
    },
    "families": {
      "type": "array",
      "items": {
        "type": "string"
      }
    },
    "proposalTelemetry": {
      "type": "object",
      "required": [
        "mergedCandidateCount",
        "returnedProposalCount"
      ],
      "properties": {
        "mergedCandidateCount": {
          "type": "integer",
          "minimum": 0
        },
        "returnedProposalCount": {
          "type": "integer",
          "minimum": 0
        }
      }
    },
    "attentionView": {
      "type": "object",
      "required": [
        "ruleVersion",
        "proposalKeys",
        "reasonCodesByProposalKey",
        "matchedRuleCount",
        "selectedCount",
        "fallbackUsed",
        "truncated"
      ],
      "properties": {
        "ruleVersion": {
          "type": "string"
        },
        "proposalKeys": {
          "type": "array",
          "items": {
            "type": "string"
          }
        },
        "reasonCodesByProposalKey": {
          "type": "object"
        },
        "matchedRuleCount": {
          "type": "integer",
          "minimum": 0
        },
        "selectedCount": {
          "type": "integer",
          "minimum": 0
        },
        "fallbackUsed": {
          "type": "boolean"
        },
        "truncated": {
          "type": "boolean"
        }
      }
    },
    "proposals": {
      "type": "array",
      "items": {
        "type": "object",
        "required": [
          "proposalKey",
          "title",
          "action",
          "family",
          "recommendedBackends",
          "existingCoverage",
          "rationale",
          "evidence",
          "draftScenario"
        ],
        "properties": {
          "proposalKey": {
            "type": "string"
          },
          "title": {
            "type": "string"
          },
          "action": {
            "type": "string",
            "enum": [
              "add_new_scenario",
              "refresh_existing_scenario"
            ]
          },
          "family": {
            "type": "string"
          },
          "intentProfile": {
            "type": "object"
          },
          "recommendedBackends": {
            "type": "array",
            "minItems": 1,
            "items": {
              "type": "string"
            }
          },
          "existingCoverage": {
            "type": "object",
            "required": [
              "scenarioKeyExists",
              "recentResultCount"
            ],
            "properties": {
              "scenarioKeyExists": {
                "type": "boolean"
              },
              "recentResultCount": {
                "type": "integer",
                "minimum": 0
              }
            }
          },
          "rationale": {
            "type": "string"
          },
          "evidence": {
            "type": "array",
            "minItems": 1,
            "items": {
              "type": "object",
              "required": [
                "sourceKind",
                "title",
                "observedAt"
              ],
              "properties": {
                "sourceKind": {
                  "type": "string",
                  "enum": [
                    "human_conversation",
                    "agent_run",
                    "skill_evaluation",
                    "workflow_run"
                  ]
                },
                "origin": {
                  "type": "string",
                  "enum": [
                    "real",
                    "synthetic",
                    "replayed",
                    "operator_authored"
                  ]
                },
                "title": {
                  "type": "string"
                },
                "observedAt": {
                  "type": "string"
                },
                "activityProvenance": {
                  "type": "object",
                  "additionalProperties": false,
                  "properties": {
                    "activityId": {
                      "type": "string",
                      "minLength": 1
                    },
                    "taskKey": {
                      "type": "string",
                      "minLength": 1
                    },
                    "recurrenceKey": {
                      "type": "string",
                      "minLength": 1
                    },
                    "replayId": {
                      "type": "string",
                      "minLength": 1
                    },
                    "split": {
                      "type": "string",
                      "enum": [
                        "proposal",
                        "train",
                        "review"
                      ]
                    },
                    "score": {
                      "type": "number"
                    }
                  }
                }
              }
            }
          },
          "draftScenario": {
            "type": "object",
            "required": [
              "schemaVersion",
              "scenarioId",
              "name",
              "description",
              "brief",
              "benchmark",
              "maxTurns",
              "runner",
              "sideEffectsMode",
              "simulator"
            ],
            "properties": {
              "schemaVersion": {
                "type": "string",
                "const": "cautilus.scenario.v1"
              },
              "scenarioId": {
                "type": "string"
              },
              "name": {
                "type": "string"
              },
              "description": {
                "type": "string"
              },
              "brief": {
                "type": "string"
              },
              "intentProfile": {
                "type": "object"
              },
              "benchmark": {
                "type": "object",
                "required": [
                  "family",
                  "scenarioKey",
                  "backend",
                  "tags"
                ],
                "properties": {
                  "family": {
                    "type": "string"
                  },
                  "scenarioKey": {
                    "type": "string"
                  },
                  "backend": {
                    "type": "string"
                  },
                  "tags": {
                    "type": "array",
                    "items": {
                      "type": "string"
                    }
                  }
                }
              },
              "maxTurns": {
                "type": "integer",
                "minimum": 1
              },
              "runner": {
                "type": "object"
              },
              "sideEffectsMode": {
                "type": "string"
              },
              "simulator": {
                "type": "object",
                "required": [
                  "kind"
                ],
                "properties": {
                  "kind": {
                    "type": "string"
                  }
                }
              }
            }
          }
        }
      }
    }
  }
}
