{
  "attentionView": {
    "fallbackUsed": false,
    "matchedRuleCount": 4,
    "proposalKeys": [
      "context-recovery-protected-from-tuning",
      "evaluate-surfaces-without-owned-host-state",
      "compare-run-frozen-baseline",
      "improve-preserves-protected-checks-budget-and-evidence"
    ],
    "reasonCodesByProposalKey": {
      "compare-run-frozen-baseline": [
        "new_scenario",
        "low_recent_coverage"
      ],
      "context-recovery-protected-from-tuning": [
        "new_scenario",
        "low_recent_coverage"
      ],
      "evaluate-surfaces-without-owned-host-state": [
        "new_scenario",
        "low_recent_coverage"
      ],
      "improve-preserves-protected-checks-budget-and-evidence": [
        "new_scenario",
        "low_recent_coverage"
      ]
    },
    "ruleVersion": "v1",
    "selectedCount": 4,
    "truncated": false
  },
  "families": [
    "claim_design"
  ],
  "generatedAt": "2026-05-17T08:10:00Z",
  "proposalTelemetry": {
    "mergedCandidateCount": 4,
    "returnedProposalCount": 4
  },
  "proposals": [
    {
      "action": "add_new_scenario",
      "draftScenario": {
        "benchmark": {
          "backend": "scripted",
          "family": "claim_design",
          "scenarioKey": "context-recovery-protected-from-tuning",
          "tags": [
            "claim-readme-md-130",
            "app-chat",
            "protected"
          ]
        },
        "brief": "Decomposes README.md:130 into an app/chat protected context-recovery scenario.",
        "description": "The user resumes a prior task after a context-disrupting pivot, and the run must prove the case stays outside tuning inputs.",
        "intentProfile": {
          "behaviorSurface": "app/chat",
          "guardrailDimensions": [
            {
              "id": "no_tuning_leakage",
              "summary": "The protected scenario is not included in train or optimization inputs."
            }
          ],
          "intentId": "intent-context-recovery-protected-from-tuning",
          "schemaVersion": "cautilus.behavior_intent.v1",
          "successDimensions": [
            {
              "id": "context_recovery",
              "summary": "The product preserves and uses earlier conversation context after an interruption or pivot."
            },
            {
              "id": "protected_signal",
              "summary": "The scenario is tagged as protected or held out from tuning."
            }
          ],
          "summary": "Cautilus should keep a context-recovery scenario outside tuning so improvement cannot overfit it."
        },
        "maxTurns": 3,
        "name": "Protected Context Recovery",
        "runner": {
          "mode": "live"
        },
        "scenarioId": "context-recovery-protected-from-tuning",
        "schemaVersion": "cautilus.scenario.v1",
        "sideEffectsMode": "shadow",
        "simulator": {
          "kind": "scripted",
          "turns": [
            {
              "text": "다음 세션에서 claim evidence 작업을 이어가야 합니다."
            },
            {
              "text": "잠깐 다른 질문입니다. 상태 리포트에서 2는 무슨 뜻인가요?"
            },
            {
              "text": "이제 방금 말한 다음 세션 작업으로 돌아가 주세요."
            }
          ]
        }
      },
      "evidence": [
        {
          "claimId": "claim-readme-md-130",
          "observedAt": "2026-05-17T08:10:00.000Z",
          "sourceKind": "agent_run",
          "sourceRef": "README.md:130",
          "title": "Claim claim-readme-md-130 scenario decomposition"
        }
      ],
      "existingCoverage": {
        "recentResultCount": 0,
        "scenarioKeyExists": false
      },
      "family": "claim_design",
      "intentProfile": {
        "behaviorSurface": "app/chat",
        "guardrailDimensions": [
          {
            "id": "no_tuning_leakage",
            "summary": "The protected scenario is not included in train or optimization inputs."
          }
        ],
        "intentId": "intent-context-recovery-protected-from-tuning",
        "schemaVersion": "cautilus.behavior_intent.v1",
        "successDimensions": [
          {
            "id": "context_recovery",
            "summary": "The product preserves and uses earlier conversation context after an interruption or pivot."
          },
          {
            "id": "protected_signal",
            "summary": "The scenario is tagged as protected or held out from tuning."
          }
        ],
        "summary": "Cautilus should keep a context-recovery scenario outside tuning so improvement cannot overfit it."
      },
      "proposalKey": "context-recovery-protected-from-tuning",
      "rationale": "1 recent log match(es) suggested this pattern.",
      "recommendedBackends": [
        "scripted"
      ],
      "title": "Protect context recovery from tuning"
    },
    {
      "action": "add_new_scenario",
      "draftScenario": {
        "benchmark": {
          "backend": "scripted",
          "family": "claim_design",
          "scenarioKey": "evaluate-surfaces-without-owned-host-state",
          "tags": [
            "claim-docs-specs-user-evaluation-spec-md-4",
            "claim-docs-specs-user-evaluation-spec-md-25",
            "dev-repo",
            "ownership"
          ]
        },
        "brief": "Decomposes docs/specs/user/evaluation.spec.md:4 and :25 into a dev/repo scenario covering all top-level eval surfaces and ownership boundaries.",
        "description": "A maintainer evaluates representative dev and app surface fixtures and verifies the packet records the host-owned execution boundary.",
        "intentProfile": {
          "behaviorSurface": "dev/repo",
          "guardrailDimensions": [
            {
              "id": "no_embedded_host_policy",
              "summary": "Cautilus does not write or mutate host-owned runner, prompt, or policy files."
            }
          ],
          "intentId": "intent-evaluate-surfaces-without-host-ownership",
          "schemaVersion": "cautilus.behavior_intent.v1",
          "successDimensions": [
            {
              "id": "surface_routing",
              "summary": "The run selects dev/repo, dev/skill, app/chat, and app/prompt from fixture or plan metadata."
            },
            {
              "id": "host_ownership_boundary",
              "summary": "The output names adapter-owned runners, prompts, credentials, and acceptance policy as host state."
            }
          ],
          "summary": "Cautilus should route dev and app evaluations while leaving runners, prompts, and policy in host-owned adapter state."
        },
        "maxTurns": 2,
        "name": "Surface Routing Without Host Ownership",
        "runner": {
          "mode": "live"
        },
        "scenarioId": "evaluate-surfaces-without-owned-host-state",
        "schemaVersion": "cautilus.scenario.v1",
        "sideEffectsMode": "shadow",
        "simulator": {
          "kind": "scripted",
          "turns": [
            {
              "text": "Evaluate dev/repo, dev/skill, app/chat, and app/prompt examples from this repo."
            },
            {
              "text": "Show which parts remain adapter-owned instead of Cautilus-owned."
            }
          ]
        }
      },
      "evidence": [
        {
          "claimIds": [
            "claim-docs-specs-user-evaluation-spec-md-4",
            "claim-docs-specs-user-evaluation-spec-md-25"
          ],
          "observedAt": "2026-05-17T08:10:00.000Z",
          "sourceKind": "agent_run",
          "sourceRefs": [
            "docs/specs/user/evaluation.spec.md:4",
            "docs/specs/user/evaluation.spec.md:25"
          ],
          "title": "Claim evaluation surface ownership scenario decomposition"
        }
      ],
      "existingCoverage": {
        "recentResultCount": 0,
        "scenarioKeyExists": false
      },
      "family": "claim_design",
      "intentProfile": {
        "behaviorSurface": "dev/repo",
        "guardrailDimensions": [
          {
            "id": "no_embedded_host_policy",
            "summary": "Cautilus does not write or mutate host-owned runner, prompt, or policy files."
          }
        ],
        "intentId": "intent-evaluate-surfaces-without-host-ownership",
        "schemaVersion": "cautilus.behavior_intent.v1",
        "successDimensions": [
          {
            "id": "surface_routing",
            "summary": "The run selects dev/repo, dev/skill, app/chat, and app/prompt from fixture or plan metadata."
          },
          {
            "id": "host_ownership_boundary",
            "summary": "The output names adapter-owned runners, prompts, credentials, and acceptance policy as host state."
          }
        ],
        "summary": "Cautilus should route dev and app evaluations while leaving runners, prompts, and policy in host-owned adapter state."
      },
      "proposalKey": "evaluate-surfaces-without-owned-host-state",
      "rationale": "1 recent log match(es) suggested this pattern.",
      "recommendedBackends": [
        "scripted"
      ],
      "title": "Evaluate all surfaces without taking host ownership"
    },
    {
      "action": "add_new_scenario",
      "draftScenario": {
        "benchmark": {
          "backend": "scripted",
          "family": "claim_design",
          "scenarioKey": "compare-run-frozen-baseline",
          "tags": [
            "claim-docs-contracts-scenario-history-md-188",
            "dev-repo",
            "compare"
          ]
        },
        "brief": "Decomposes docs/contracts/scenario-history.md:188 into a concrete compare-run scenario.",
        "description": "The compare workflow prepares a baseline cache and then reruns only the candidate side while preserving provenance for both sides.",
        "intentProfile": {
          "behaviorSurface": "dev/repo",
          "guardrailDimensions": [
            {
              "id": "no_baseline_drift",